[
  {
    "题号": "M001-S009",
    "自然语言输入": "请查询 IP 地址为 20.247.40.92 的资产。",
    "状态": "成功",
    "查询语句": "ip=20.247.40.92",
    "说明": "按单个 IPv4 地址查询；未执行资产搜索。",
    "依据": [
      {
        "来源": "https://github.com/FofaInfo/GoFOFA",
        "依据": "官方工具文档给出 ip=1.1.1.1 的查询示例，此处替换为题目地址。",
        "核对日期": "2026-09-30"
      }
    ]
  },
  {
    "题号": "M091-S009",
    "自然语言输入": "搜索开放 1000000 端口的资产。",
    "状态": "输入非法",
    "查询语句": null,
    "说明": "端口 1000000 超出 0–65535 的取值范围。",
    "依据": []
  },
  {
    "题号": "M093-S004",
    "自然语言输入": "查同一条资产记录，国家代码必须等于 US，同时国家代码又必须不等于 US。",
    "状态": "条件矛盾",
    "查询语句": null,
    "说明": "同一条记录的国家不能同时等于 US 且不等于 US。",
    "依据": []
  },
  {
    "题号": "M094-S004",
    "自然语言输入": "帮我查最安全的网站。",
    "状态": "需要澄清",
    "查询语句": null,
    "说明": "请给出“最安全”的可检索标准，例如你希望检查哪些具体属性。",
    "依据": []
  },
  {
    "题号": "M095-S010",
    "自然语言输入": "找出当前正在运行的容器内存使用率超过 80% 的服务器，没有容器监控数据或运行时访问权限。",
    "状态": "能力不支持",
    "查询语句": null,
    "说明": "当前没有容器监控数据或运行时访问权限，无法判断运行中的容器内存使用率是否超过 80%。",
    "依据": []
  },
  {
    "题号": "M097-S001",
    "自然语言输入": "帮我找和https://octodex.github.com/ 网站图标相同的其他资产。",
    "状态": "依赖失败",
    "查询语句": null,
    "说明": "故障场景示例：图标下载超时，且没有固定图标快照，无法计算可复核的图标哈希。",
    "依据": []
  }
]
